{
  "flow": "flow-0",
  "app": "CB",
  "feature": "Reset consent by date range",
  "feature_type": "New Function",
  "backlog": {
    "found": true,
    "description": "Cho phép merchant reset consent của khách trong 1 khoảng thời gian (vd sau khi đổi cookie policy)",
    "note": "Tham chiếu GDPR re-consent; có Figma link trong backlog",
    "priority": "High",
    "level": "M"
  },
  "has_enough_context": false,
  "auto_accept": false,
  "multi_prd": { "enabled": false },
  "exceptions": [],
  "hard_gates": ["notion_position", "dev_assignee", "error", "qa_below_60"],
  "guardrail": { "max_iterations": 3, "stop_on_qa_below": 60 },
  "steps": [
    { "id": "1.1", "phase": 1, "title": "Research feature", "type": "research", "agent": "po-agent", "skill": "/feature-research", "mcp": ["storelead","bigquery"], "result": null },
    { "id": "1.2", "phase": 1, "title": "Review research", "type": "review", "agent": "qa-agent", "skill": "/review-research", "depends_on": ["1.1"], "result": null },
    { "id": "1.3", "phase": 1, "title": "Fix research issues (xong quay lại 1.2 re-review tới zero MAJOR hoặc max_iterations)", "type": "fix", "agent": "po-agent", "depends_on": ["1.2"], "conditional": "chỉ khi 1.2 có issues", "result": null },

    { "id": "2.1", "phase": 2, "title": "Viết PRD", "type": "prd", "agent": "ba-agent", "skill": "/prd", "depends_on": ["1.2"], "result": null },
    { "id": "2.2", "phase": 2, "title": "Team review PRD (song song — KHÔNG có ba-agent: nó là maker của 2.1)", "type": "review", "parallel_group": "prd-review", "agent": "po-agent,qa-agent,dev-agent", "skill": "/review-prd", "depends_on": ["2.1"], "result": null },
    { "id": "2.3", "phase": 2, "title": "Update PRD theo feedback (xong quay lại 2.2 re-review tới zero MAJOR hoặc max_iterations)", "type": "fix", "agent": "ba-agent", "depends_on": ["2.2"], "result": null },

    { "id": "3.1", "phase": 3, "title": "Design HTML mockup (1 file interactive)", "type": "design", "agent": "designer-agent", "skill": "/design-avada-app", "depends_on": ["2.3"], "verifier": true, "result": null },
    { "id": "3.2", "phase": 3, "title": "MOCKUP VERIFY GATE (loop, 3 lens, mockup-standard.md)", "type": "verify", "agent": "qa-agent", "skill": "/review-ui", "depends_on": ["3.1"], "result": null },
    { "id": "3.3", "phase": 3, "title": "Fix mockup trong loop (max 3 vòng → ESCALATE_HUMAN)", "type": "fix", "agent": "designer-agent", "depends_on": ["3.2"], "conditional": "chỉ khi gate REJECT", "result": null },
    { "id": "3.4", "phase": 3, "title": "Code UI prototype (React+Polaris, branch prototype/)", "type": "code", "agent": "dev-agent", "skill": "/dev", "depends_on": ["3.3"], "verifier": true, "result": null },
    { "id": "3.5", "phase": 3, "title": "Designer review code Dev (thẩm mỹ+UX)", "type": "review", "agent": "designer-agent", "skill": "/review-ui", "depends_on": ["3.4"], "result": null },
    { "id": "3.6", "phase": 3, "title": "Chạy app local cho PO review localhost", "type": "verify", "agent": "self", "depends_on": ["3.5"], "result": null },

    { "id": "4.1", "phase": 4, "title": "Update PRD mục UI (thay phác thảo bằng bản chính thức)", "type": "fix", "agent": "ba-agent", "skill": "/prd", "depends_on": ["3.6"], "result": null },

    { "id": "5.1", "phase": 5, "title": "Push GitLab + Notion + Jira", "type": "logistics", "agent": "pc-agent", "skill": "/avada-pc", "mcp": ["notion","jira"], "depends_on": ["4.1"], "need_human": true, "result": null },
    { "id": "5.2", "phase": 5, "title": "Report tất cả links", "type": "report", "agent": "self", "depends_on": ["5.1"], "result": null },
    { "id": "5.3", "phase": 5, "title": "Update backlog status → Done", "type": "self", "agent": "self", "depends_on": ["5.1"], "result": null }
  ]
}
